{
    "id": 48,
    "hexagram_code": "䷯",
    "name": "Restoration",
    "description": "The process of renewal and replenishment after depletion. Like a well being refilled or an ecosystem recovering after disruption, this represents the natural cycle of restoration and the return of vitality.",
    "king_wen": {
        "sequence": 48,
        "traditional_title": "Jing/The Well",
        "common_title": ""
    },
    "binary_sequence": 22,
    "trigrams": {
        "above": {
            "Trigram Number": 6,
            "Binary Decimal": 2,
            "Symbol": "☵",
            "Chinese Symbol": "坎",
            "Phonetic": "Kǎn",
            "English Translation": "Water",
            "English Symbol": "水",
            "Meaning": "The Abysmal",
            "Quality": "Deep and Mysterious"
        },
        "below": {
            "Trigram Number": 5,
            "Binary Decimal": 6,
            "Symbol": "☴",
            "Chinese Symbol": "巽",
            "Phonetic": "Xùn",
            "English Translation": "Wind/Wood",
            "English Symbol": "风/木",
            "Meaning": "The Gentle",
            "Quality": "Gentle and Penetrating"
        }
    },
    "attributes": {
        "perspective": "The renewal of resources through steady nourishment",
        "nature": "Restorative, nourishing, sustaining",
        "action": "Replenishment, maintenance, cultivation",
        "success_through": "Consistent care and attention to fundamental needs",
        "challenge": "Maintaining reliable access to essential resources"
    },
    "lines": [
        {
            "position": 6,
            "name": "Completing the Cycle",
            "meaning": "The culmination of restoration, where the journey of transformation is fully realized and a new beginning is set.",
            "changing": "The full circle of yin, transformed and perfected, seamlessly emerges as a potent yang force, heralding rebirth."
        },
        {
            "position": 5,
            "name": "Illuminated Ascent",
            "meaning": "A stage marked by clarity and elevation; the restored energy ascends, guiding the path to transformation.",
            "changing": "The mature, enlightened yin transitions smoothly into a radiant yang, highlighting emerging strength."
        },
        {
            "position": 4,
            "name": "Flourishing Revival",
            "meaning": "A vibrant phase where restoration gains momentum, invoking dynamic growth and forward movement.",
            "changing": "The deep, reflective yin energy channels into a robust yang force, manifesting as a flourishing revival."
        },
        {
            "position": 3,
            "name": "Harmonious Integration",
            "meaning": "A balanced moment when opposing forces merge, establishing a firm foundation for further restoration.",
            "changing": "Here, yin’s quiet persistence is infused with yang’s vitality, leading to a balanced reconfiguration of energy."
        },
        {
            "position": 2,
            "name": "Shifting Currents",
            "meaning": "A period of subtle transformation where energies intermingling create the conditions for growth.",
            "changing": "The hidden aspects of yin start to reveal their potential, gradually morphing into a gentle, rising yang influence."
        },
        {
            "position": 1,
            "name": "Emerging Seed",
            "meaning": "The initial stir of change; a quiet but resolute beginning that holds the promise of renewal.",
            "changing": "In this line, dormant yin energy awakens, setting the stage for a transformative surge of yang."
        }
    ],
    "tholonic_analysis": {
        "negotiation": "The hexagram represents the balance between giving and receiving nourishment. The gentle wind below supports the movement of water above, showing how subtle forces can maintain essential resources when properly channeled.",
        "limitation": "The structure defines boundaries between sustainable use and depletion. It establishes how resources must be maintained within natural cycles, showing that ongoing restoration requires consistent care.",
        "contribution": "This configuration contributes to systemic evolution by demonstrating how resources can be sustainably maintained. It shows how proper stewardship ensures continuing availability of essential elements.",
        "significance_in_thologram": "Represents the critical function of resource renewal in any system. Functions as a model for how awareness maintains access to vital resources. Important in understanding how systems sustain themselves through proper resource management."
    },
    "transformations": {
        "no_moving_lines": "The situation calls for steady maintenance and careful stewardship. Continue tending to essential resources while ensuring sustainable access. Success comes through consistent care.",
        "all_moving_lines": "Complete transformation of the resource system is occurring. All aspects of maintenance are in flux. The restoration will create fundamental change, requiring careful attention to maintaining reliable access to essentials."
    },
    "hierarchy": {
        "order8child": "Finding foundation",
        "order8parent": "RESOLUTION; Moving Toward Completion"
    },
    "image": {
        "description": "The chosen subject and medium of an underwater coral nursery embody the hexagram's themes of restoration and renewal. The coral garden illustrates universal patterns of growth and resilience, rising from the ocean floor in a dynamic interplay of life and resourcefulness. The triadic relationship is observed between coral, water, and sunlight, representing the balance that sustains life. This image captures the emergence of order from natural chaos, as fragile coral structures form complex and harmonious patterns. The coral's nurturing environment underscores the principle of consistent care in maintaining essential resources, reflecting a delicate balance between structure and fluidity. By visually depicting these interconnected relationships, the image serves as a metaphor for how nurturing efforts lead to sustained vitality and evolution within any system.",
        "file": "48.png"
    },
    "energy_cycle": "ascending",
    "stories": {
        "title": "Three Tales of \"Restoration",
        "entries": [
            {
                "title": "The Underground Library (Man vs. Man)",
                "theme": "Jorge Luis Borges",
                "summary": "Deep beneath the streets of a city whose name had been erased, there existed a library where banned books came to be reborn. In rooms connected by tunnels that seemed to fold back upon themselves like a Möbius strip, a small group of archivists worked tirelessly to restore texts that the Algorithms had deemed dangerous. Their leader, an old woman who had once been a quantum programmer, understood that each book was not merely paper and ink, but a well of consciousness that needed constant tending. They worked with ancient scanners and jury-rigged printers, transforming fragile physical pages into immortal digital specters. Some books arrived as mere fragments, others as corrupt data streams, yet each was restored with the patience of archaeologists reconstructing a civilization from scattered shards. When the authorities came searching, they found only empty rooms - the library had learned to shift through quantum dimensions, becoming like Schrödinger's cat, simultaneously everywhere and nowhere, preserving humanity's stories until they could safely resurface.",
                "lines_in_context": {
                    "6": {
                        "name": "Completion",
                        "meaning": "Signifying the closing of a cycle, surrender to change, or refinement of experience. Represents outer conditions and the realm of action, interaction, and external manifestation.",
                        "changing": "If Yang replaces Yin, it may indicate resistance to closure, clinging to power, or forced extension of a process that has run its course."
                    },
                    "5": {
                        "name": "Engagement",
                        "meaning": "Full engagement in the world, leadership, and execution of potential. Represents outer conditions and the realm of action, interaction, and external manifestation.",
                        "changing": "If Yin replaces Yang, it could mean indecision, loss of authority, or an incomplete realization of the vision."
                    },
                    "4": {
                        "name": "Alignment",
                        "meaning": "Alignment with external forces and preparation for action. Represents outer conditions and the realm of action, interaction, and external manifestation.",
                        "changing": "If Yang replaces Yin, it may suggest premature external assertion before the conditions are stable."
                    },
                    "3": {
                        "name": "Transition",
                        "meaning": "Culmination of the inner process and transition to external action. Represents inner conditions and the realm of potential, preparation, and internal transformation.",
                        "changing": "If Yin replaces Yang, it suggests hesitation in carrying inner realization outward, or stagnation at the threshold of change."
                    },
                    "2": {
                        "name": "Formation",
                        "meaning": "Support, alignment, and structuring of potential. Represents inner conditions and the realm of potential, preparation, and internal transformation.",
                        "changing": "If Yang replaces Yin, it may indicate premature action, instability, or struggle to integrate."
                    },
                    "1": {
                        "name": "Emergence",